{
  "legacy_catalogs": [
    "corpus/catalogs/awesome-pentest-enaqx-v1.json",
    "corpus/catalogs/awesome-security-sbilly-v1.json"
  ],
  "release_id": "strange-candidate-v0.3",
  "reviews": [
    "corpus/reviews/0xdf-v1.json",
    "corpus/reviews/abusech-v1.json",
    "corpus/reviews/bellingcat-v1.json",
    "corpus/reviews/bishopfox-research-v1.json",
    "corpus/reviews/check-point-v1.json",
    "corpus/reviews/dfirch-v1.json",
    "corpus/reviews/dfirreport-posts-v1.json",
    "corpus/reviews/doyensec-archive-v1.json",
    "corpus/reviews/elastic-v1.json",
    "corpus/reviews/gtfobins-index-v1.json",
    "corpus/reviews/hacktricks-en-v1.json",
    "corpus/reviews/hexacorn-v1.json",
    "corpus/reviews/lolbas-index-v1.json",
    "corpus/reviews/malwaretraffic-v1.json",
    "corpus/reviews/mta2024-v1.json",
    "corpus/reviews/mta2025-v1.json",
    "corpus/reviews/nviso-v1.json",
    "corpus/reviews/payloadsallthethings-v1.json",
    "corpus/reviews/pocorgtfo-v1.json",
    "corpus/reviews/portswigger-sitemap-v1.json",
    "corpus/reviews/projectzero-archive-v1.json",
    "corpus/reviews/redcanary-sitemap-v1.json",
    "corpus/reviews/ropnop-archive-v1.json",
    "corpus/reviews/samcurry-archive-v1.json",
    "corpus/reviews/sector035-v1.json",
    "corpus/reviews/securelist-v1.json",
    "corpus/reviews/sentinelone-v1.json",
    "corpus/reviews/stark4n6-v1.json",
    "corpus/reviews/synacktiv-v1.json",
    "corpus/reviews/trailofbits-v1.json",
    "corpus/reviews/unit42-v1.json",
    "corpus/reviews/usenix-security24-v1.json",
    "corpus/reviews/usenix-security25-v1.json",
    "corpus/reviews/usenix-woot24-v1.json",
    "corpus/reviews/watchtowr-v1.json",
    "corpus/reviews/strange-binary-golf-v1.json",
    "corpus/reviews/strange-binarygolf5-v1.json",
    "corpus/reviews/strange-cryptopals6-v1.json",
    "corpus/reviews/strange-cryptopals7-v1.json",
    "corpus/reviews/strange-cturtarticles-v1.json",
    "corpus/reviews/strange-evil32-v1.json",
    "corpus/reviews/strange-greatscott-v1.json",
    "corpus/reviews/strange-guriarxiv-v1.json",
    "corpus/reviews/strange-hackingart-v1.json",
    "corpus/reviews/strange-lcamtuf-v1.json",
    "corpus/reviews/strange-pagedout-v1.json",
    "corpus/reviews/strange-priyom-v1.json",
    "corpus/reviews/strange-pwnadventure-v1.json",
    "corpus/reviews/strange-serge-v1.json",
    "corpus/reviews/strange-shambles-v1.json",
    "corpus/reviews/strange-sigidwiki-v1.json",
    "corpus/reviews/strange-siguza-v1.json",
    "corpus/reviews/strange-spammimic-v1.json",
    "corpus/reviews/strange-spritessecurity-v1.json",
    "corpus/reviews/strange-taviso-v1.json",
    "corpus/reviews/strange-tinyelf-v1.json",
    "corpus/reviews/strange-tmpout1-v1.json",
    "corpus/reviews/strange-tmpout2-v1.json",
    "corpus/reviews/strange-tmpout3-v1.json",
    "corpus/reviews/strange-tmpout4-v1.json",
    "corpus/reviews/strange-trmm-v1.json",
    "corpus/reviews/strange-tromer-v1.json",
    "corpus/reviews/strange-tromeracoustic-v1.json",
    "corpus/reviews/strange-weirdmachines-v1.json",
    "corpus/reviews/strange-windytanposts-v1.json"
  ],
  "schema": "r4b1t-expansion-registry-v1"
}
